{
    "$schema": "https://json-schema.org/draft/2020-12/schema",
    "required": [
        "api",
        "authentication",
        "inference_endpoint"
    ],
    "unevaluatedProperties": false,
    "properties": {
        "api": {
            "description": "The API to use for scoring.",
            "oneOf": [
                {
                    "$ref": "file:///driver/src/batch_score/common/configuration/file/schemas/public/api/completion.json"
                },
                {
                    "$ref": "file:///driver/src/batch_score/common/configuration/file/schemas/public/api/chat_completion.json"
                },
                {
                    "$ref": "file:///driver/src/batch_score/common/configuration/file/schemas/public/api/embedding.json"
                }
            ]
        },
        "authentication": {
            "description": "Specifies how to authenticate scoring requests.",
            "oneOf": [
                {
                    "$ref": "file:///driver/src/batch_score/common/configuration/file/schemas/public/authentication/connection.json"
                },
                {
                    "$ref": "file:///driver/src/batch_score/common/configuration/file/schemas/public/authentication/managed_identity.json"
                }
            ]
        },
        "concurrency_settings": {
            "$ref": "file:///driver/src/batch_score/common/configuration/file/schemas/public/concurrency_settings.json",
            "default": {}
        },
        "inference_endpoint": {
            "oneOf": [
                {
                    "$ref": "file:///driver/src/batch_score/common/configuration/file/schemas/public/inference_endpoint/azure_openai.json"
                },
                {
                    "$ref": "file:///driver/src/batch_score/common/configuration/file/schemas/public/inference_endpoint/azureml_online_endpoint.json"
                },
                {
                    "$ref": "file:///driver/src/batch_score/common/configuration/file/schemas/public/inference_endpoint/azureml_serverless_endpoint.json"
                }
            ]
        },
        "request_settings": {
            "$ref": "file:///driver/src/batch_score/common/configuration/file/schemas/public/request_settings.json",
            "default": {}
        },
        "log_settings": {
            "$ref": "file:///driver/src/batch_score/common/configuration/file/schemas/public/log_settings.json",
            "default": {}
        },
        "output_settings": {
            "$ref": "file:///driver/src/batch_score/common/configuration/file/schemas/public/output_settings.json",
            "default": {}
        }
    }
}