{
    "api": {
        "type": "completion"
    },
    "authentication": {
        "type": "managed_identity"
    },
    "concurrency_settings": {
        "initial_worker_count": 20,
        "max_worker_count": 100
    },
    "inference_endpoint": {
        "type": "azure_openai",
        "url": "https://sunjoli-aoai.openai.azure.com/openai/deployments/turbo/completions?api-version=2023-03-15-preview"
    }
}