{
    "api": {
        "type": "completion"
    },
    "authentication": {
        "type": "managed_identity"
    },
    "inference_endpoint": {
        "type": "azure_openai",
        "url": "https://sunjoli-aoai.openai.azure.com/openai/deployments/turbo/completions?api-version=2023-03-15-preview"
    },
    "output_settings": {
        "ensure_ascii": true,
        "save_partitioned_scoring_results": true
    }
}