{
    "api": {
        "type": "completion"
    },
    "authentication": {
        "type": "managed_identity"
    },
    "inference_endpoint": {
        "type": "azure_openai",
        "url": "https://sunjoli-aoai.openai.azure.com/openai/deployments/turbo/completions?api-version=2023-03-15-preview"
    },
    "log_settings": {
        "app_insights_connection_string": "InstrumentationKey=00000000-0000-0000-0000-000000000000;IngestionEndpoint=https://westus2-2.ingest.ai.applicationinsights.io/",
        "app_insights_log_level": "debug",
        "stdout_log_level": "info"
    }
}